{
  "actor": "system",
  "commit": "c732108540f50ea0cf2cec3de7e9153d7eb2615d",
  "decided_at": "2026-10-04T04:00:28Z",
  "decision_id": "1774bf96565fc8de647e8f7c622f650a",
  "fingerprint": "b38b797281230b35",
  "plugin_id": "yandex-smart-home",
  "repo": "Voltur792/Y-home-f-astra",
  "repository_id": "1364261342",
  "repository_owner_id": "232130437",
  "schema": "astra.registry.decision/1",
  "state": "published",
  "tag": "v0.1.3",
  "trigger": "migration",
  "version": "0.1.3"
}
