{
  "actor": "bot",
  "artifact_digests": [
    "noarch:b05ff420d20742c3557083d0ef4fbb2588a1e1fb3f8ec9a6d8ebd6b5b30eccb9"
  ],
  "commit": "4e2db6aa774e83ceb2923ee524e22fec60cc3d59",
  "decided_at": "2026-10-16T05:10:38Z",
  "decision_id": "5a785675c0f981e12a25596d8cde3e97",
  "fingerprint": "f93bc0cd3b915781",
  "plugin_id": "music-controller",
  "reasons": [
    "P_PUBLISHED",
    "P_REVIEW_PRIORITY"
  ],
  "repo": "Voltur792/astra-music",
  "repository_id": "1394395108",
  "repository_owner_id": "232130437",
  "run": "38854252516/1",
  "schema": "astra.registry.decision/1",
  "state": "published",
  "submission_id": "4d558b28-d600-41b3-a0a9-c8335a22b509",
  "tag": "v1.3.2",
  "trigger": "panel",
  "version": "1.3.2"
}
